{
  "$schema": "../node-definition.schema.json",
  "type": "action.join_voice",
  "version": 1,
  "category": "action",
  "group": "voice",
  "order": 360,
  "color": "green",
  "icon": "▶︎",
  "labelKey": "builder.node.action_join_voice.label",
  "descriptionKey": "builder.node.action_join_voice.description",
  "inputs": [
    {
      "name": "in",
      "type": "flow",
      "labelKey": "builder.port.in",
      "multiple": true
    }
  ],
  "outputs": [
    {
      "name": "next",
      "type": "flow",
      "labelKey": "builder.port.next"
    }
  ],
  "config": {
    "type": "object",
    "additionalProperties": false,
    "properties": {
      "channel": {
        "type": "string",
        "maxLength": 200,
        "x-labelKey": "builder.cfg.channel",
        "x-hintKey": "builder.cfg.ref_hint",
        "x-ref": "channel"
      },
      "guild": {
        "type": "string",
        "maxLength": 40,
        "x-advanced": true,
        "x-mono": true,
        "x-labelKey": "builder.cfg.guild",
        "x-hintKey": "builder.cfg.guild_hint"
      }
    }
  }
}
