{
  "$schema": "../node-definition.schema.json",
  "type": "action.leveling_leaderboard",
  "version": 1,
  "category": "action",
  "group": "leveling",
  "order": 1070,
  "color": "purple",
  "icon": "▶︎",
  "labelKey": "builder.node.action_leveling_leaderboard.label",
  "descriptionKey": "builder.node.action_leveling_leaderboard.description",
  "module": "leveling",
  "inputs": [
    {
      "name": "in",
      "type": "flow",
      "labelKey": "builder.port.in",
      "multiple": true
    }
  ],
  "outputs": [
    {
      "name": "next",
      "type": "flow",
      "labelKey": "builder.port.next"
    }
  ],
  "config": {
    "type": "object",
    "additionalProperties": false,
    "properties": {
      "limit": {
        "type": "number",
        "minimum": 1,
        "x-labelKey": "builder.cfg.limit_entries",
        "maximum": 50,
        "default": 10
      },
      "variable": {
        "type": "string",
        "pattern": "^[A-Za-z][A-Za-z0-9_]{0,31}$",
        "x-labelKey": "builder.cfg.variable",
        "x-hintKey": "builder.cfg.variable_hint"
      }
    }
  }
}
