{
  "$schema": "../node-definition.schema.json",
  "type": "action.economy_reset",
  "version": 1,
  "category": "action",
  "group": "economy",
  "order": 910,
  "color": "teal",
  "icon": "▶︎",
  "labelKey": "builder.node.action_economy_reset.label",
  "descriptionKey": "builder.node.action_economy_reset.description",
  "module": "economy",
  "inputs": [
    {
      "name": "in",
      "type": "flow",
      "labelKey": "builder.port.in",
      "multiple": true
    }
  ],
  "outputs": [
    {
      "name": "next",
      "type": "flow",
      "labelKey": "builder.port.next"
    }
  ],
  "config": {
    "type": "object",
    "additionalProperties": false,
    "properties": {
      "user": {
        "type": "string",
        "maxLength": 200,
        "x-labelKey": "builder.cfg.user",
        "x-hintKey": "builder.cfg.ref_hint",
        "x-ref": "member",
        "default": "{user.id}"
      }
    }
  }
}
