{
  "$schema": "../node-definition.schema.json",
  "type": "action.mod_note_add",
  "version": 1,
  "category": "action",
  "group": "server",
  "order": 760,
  "color": "orange",
  "icon": "▶︎",
  "labelKey": "builder.node.action_mod_note_add.label",
  "descriptionKey": "builder.node.action_mod_note_add.description",
  "inputs": [
    {
      "name": "in",
      "type": "flow",
      "labelKey": "builder.port.in",
      "multiple": true
    }
  ],
  "outputs": [
    {
      "name": "next",
      "type": "flow",
      "labelKey": "builder.port.next"
    }
  ],
  "results": [
    {
      "suffix": "",
      "labelKey": "builder.result.mod_note_add.0"
    }
  ],
  "config": {
    "type": "object",
    "additionalProperties": false,
    "properties": {
      "user": {
        "type": "string",
        "maxLength": 200,
        "x-labelKey": "builder.cfg.user",
        "x-hintKey": "builder.cfg.ref_hint",
        "x-ref": "member",
        "default": "{user.id}"
      },
      "note": {
        "type": "string",
        "maxLength": 1000,
        "x-labelKey": "builder.cfg.mod_note",
        "x-multiline": true
      },
      "variable": {
        "type": "string",
        "pattern": "^[A-Za-z][A-Za-z0-9_]{0,31}$",
        "x-labelKey": "builder.cfg.variable",
        "x-hintKey": "builder.cfg.variable_hint"
      },
      "guild": {
        "type": "string",
        "maxLength": 40,
        "x-advanced": true,
        "x-mono": true,
        "x-labelKey": "builder.cfg.guild",
        "x-hintKey": "builder.cfg.guild_hint"
      }
    }
  }
}
