{
  "$schema": "../node-definition.schema.json",
  "type": "action.remove_roles_all",
  "version": 1,
  "category": "action",
  "group": "role",
  "order": 450,
  "color": "purple",
  "icon": "▶︎",
  "labelKey": "builder.node.action_remove_roles_all.label",
  "descriptionKey": "builder.node.action_remove_roles_all.description",
  "inputs": [
    {
      "name": "in",
      "type": "flow",
      "labelKey": "builder.port.in",
      "multiple": true
    }
  ],
  "outputs": [
    {
      "name": "next",
      "type": "flow",
      "labelKey": "builder.port.next"
    }
  ],
  "results": [
    {
      "suffix": ".changed",
      "labelKey": "builder.result.remove_roles_all.0"
    },
    {
      "suffix": ".skipped",
      "labelKey": "builder.result.remove_roles_all.1"
    },
    {
      "suffix": ".errors",
      "labelKey": "builder.result.remove_roles_all.2"
    }
  ],
  "config": {
    "type": "object",
    "additionalProperties": false,
    "properties": {
      "roles": {
        "type": "string",
        "maxLength": 1000,
        "x-labelKey": "builder.cfg.roles",
        "x-hintKey": "builder.cfg.roles_hint",
        "x-ref": "roles"
      },
      "reason": {
        "type": "string",
        "maxLength": 200,
        "x-labelKey": "builder.cfg.reason",
        "x-hintKey": "builder.cfg.reason_hint"
      },
      "variable": {
        "type": "string",
        "pattern": "^[A-Za-z][A-Za-z0-9_]{0,31}$",
        "x-labelKey": "builder.cfg.variable",
        "x-hintKey": "builder.cfg.variable_hint"
      },
      "guild": {
        "type": "string",
        "maxLength": 40,
        "x-advanced": true,
        "x-mono": true,
        "x-labelKey": "builder.cfg.guild",
        "x-hintKey": "builder.cfg.guild_hint"
      }
    }
  }
}
